{
  "distanceToleranceMeters" : 0.050000000000000003,
  "family" : "movement",
  "schemaVersion" : 1,
  "source" : {
    "generatedBy" : "WaykinVectorExport",
    "swiftTree" : "94eaeb810901d089f89d17ed631534a4b56b0da6"
  },
  "steps" : [
    {
      "expected" : {
        "diagnostic" : {
          "accumulatedDistance" : false,
          "accuracyBucket" : "precise",
          "derivedSpeedMetersPerSecond" : 0,
          "disposition" : "rejectedInvalid",
          "timestamp" : 1000
        },
        "distanceDelta" : 0,
        "isMoving" : false,
        "point" : null,
        "sampleInterval" : 0
      },
      "index" : 0,
      "receivedAt" : 1000,
      "resetBefore" : false,
      "sample" : {
        "altitude" : 10,
        "horizontalAccuracy" : 5,
        "latitude" : "NaN",
        "longitude" : 0,
        "reportedSpeedMetersPerSecond" : "NaN",
        "timestamp" : 1000
      }
    },
    {
      "expected" : {
        "diagnostic" : {
          "accumulatedDistance" : false,
          "accuracyBucket" : "precise",
          "derivedSpeedMetersPerSecond" : 0,
          "disposition" : "rejectedInvalid",
          "timestamp" : 1000
        },
        "distanceDelta" : 0,
        "isMoving" : false,
        "point" : null,
        "sampleInterval" : 0
      },
      "index" : 1,
      "receivedAt" : 1000,
      "resetBefore" : false,
      "sample" : {
        "altitude" : 10,
        "horizontalAccuracy" : 5,
        "latitude" : 91,
        "longitude" : 0,
        "reportedSpeedMetersPerSecond" : "NaN",
        "timestamp" : 1000
      }
    },
    {
      "expected" : {
        "diagnostic" : {
          "accumulatedDistance" : false,
          "accuracyBucket" : "precise",
          "derivedSpeedMetersPerSecond" : 0,
          "disposition" : "rejectedInvalid",
          "timestamp" : 1000
        },
        "distanceDelta" : 0,
        "isMoving" : false,
        "point" : null,
        "sampleInterval" : 0
      },
      "index" : 2,
      "receivedAt" : 1000,
      "resetBefore" : false,
      "sample" : {
        "altitude" : 10,
        "horizontalAccuracy" : 5,
        "latitude" : 0,
        "longitude" : 181,
        "reportedSpeedMetersPerSecond" : "NaN",
        "timestamp" : 1000
      }
    },
    {
      "expected" : {
        "diagnostic" : {
          "accumulatedDistance" : false,
          "accuracyBucket" : "invalid",
          "derivedSpeedMetersPerSecond" : 0,
          "disposition" : "rejectedInvalid",
          "timestamp" : 1000
        },
        "distanceDelta" : 0,
        "isMoving" : false,
        "point" : null,
        "sampleInterval" : 0
      },
      "index" : 3,
      "receivedAt" : 1000,
      "resetBefore" : false,
      "sample" : {
        "altitude" : 10,
        "horizontalAccuracy" : "Infinity",
        "latitude" : 0,
        "longitude" : 0,
        "reportedSpeedMetersPerSecond" : "NaN",
        "timestamp" : 1000
      }
    },
    {
      "expected" : {
        "diagnostic" : {
          "accumulatedDistance" : false,
          "accuracyBucket" : "invalid",
          "derivedSpeedMetersPerSecond" : 0,
          "disposition" : "rejectedNegativeAccuracy",
          "timestamp" : 1000
        },
        "distanceDelta" : 0,
        "isMoving" : false,
        "point" : null,
        "sampleInterval" : 0
      },
      "index" : 4,
      "receivedAt" : 1000,
      "resetBefore" : false,
      "sample" : {
        "altitude" : 10,
        "horizontalAccuracy" : -1,
        "latitude" : 0,
        "longitude" : 0,
        "reportedSpeedMetersPerSecond" : "NaN",
        "timestamp" : 1000
      }
    },
    {
      "expected" : {
        "diagnostic" : {
          "accumulatedDistance" : false,
          "accuracyBucket" : "poor",
          "derivedSpeedMetersPerSecond" : 0,
          "disposition" : "rejectedAccuracy",
          "timestamp" : 1000
        },
        "distanceDelta" : 0,
        "isMoving" : false,
        "point" : null,
        "sampleInterval" : 0
      },
      "index" : 5,
      "receivedAt" : 1000,
      "resetBefore" : false,
      "sample" : {
        "altitude" : 10,
        "horizontalAccuracy" : 31,
        "latitude" : 0,
        "longitude" : 0,
        "reportedSpeedMetersPerSecond" : "NaN",
        "timestamp" : 1000
      }
    },
    {
      "expected" : {
        "diagnostic" : {
          "accumulatedDistance" : false,
          "accuracyBucket" : "precise",
          "derivedSpeedMetersPerSecond" : 0,
          "disposition" : "rejectedStale",
          "timestamp" : 1000
        },
        "distanceDelta" : 0,
        "isMoving" : false,
        "point" : null,
        "sampleInterval" : 0
      },
      "index" : 6,
      "receivedAt" : 1016,
      "resetBefore" : false,
      "sample" : {
        "altitude" : 10,
        "horizontalAccuracy" : 5,
        "latitude" : 0,
        "longitude" : 0,
        "reportedSpeedMetersPerSecond" : "NaN",
        "timestamp" : 1000
      }
    },
    {
      "expected" : {
        "diagnostic" : {
          "accumulatedDistance" : false,
          "accuracyBucket" : "precise",
          "derivedSpeedMetersPerSecond" : 0,
          "disposition" : "rejectedInvalid",
          "timestamp" : 1000
        },
        "distanceDelta" : 0,
        "isMoving" : false,
        "point" : null,
        "sampleInterval" : 0
      },
      "index" : 7,
      "receivedAt" : 997,
      "resetBefore" : false,
      "sample" : {
        "altitude" : 10,
        "horizontalAccuracy" : 5,
        "latitude" : 0,
        "longitude" : 0,
        "reportedSpeedMetersPerSecond" : "NaN",
        "timestamp" : 1000
      }
    },
    {
      "expected" : {
        "diagnostic" : {
          "accumulatedDistance" : false,
          "accuracyBucket" : "precise",
          "derivedSpeedMetersPerSecond" : 0,
          "disposition" : "awaitingFreshAnchor",
          "timestamp" : 1000
        },
        "distanceDelta" : 0,
        "isMoving" : false,
        "point" : {
          "altitude" : 10,
          "latitude" : 0,
          "longitude" : 0,
          "speed" : 0,
          "timestamp" : 1000
        },
        "sampleInterval" : 0
      },
      "index" : 8,
      "receivedAt" : 1015,
      "resetBefore" : false,
      "sample" : {
        "altitude" : 10,
        "horizontalAccuracy" : 5,
        "latitude" : 0,
        "longitude" : 0,
        "reportedSpeedMetersPerSecond" : "NaN",
        "timestamp" : 1000
      }
    },
    {
      "expected" : {
        "diagnostic" : {
          "accumulatedDistance" : false,
          "accuracyBucket" : "precise",
          "derivedSpeedMetersPerSecond" : 0,
          "disposition" : "rejectedDuplicate",
          "timestamp" : 1000
        },
        "distanceDelta" : 0,
        "isMoving" : false,
        "point" : null,
        "sampleInterval" : 0
      },
      "index" : 9,
      "receivedAt" : 1000,
      "resetBefore" : false,
      "sample" : {
        "altitude" : 10,
        "horizontalAccuracy" : 5,
        "latitude" : 0,
        "longitude" : 0,
        "reportedSpeedMetersPerSecond" : "NaN",
        "timestamp" : 1000
      }
    },
    {
      "expected" : {
        "diagnostic" : {
          "accumulatedDistance" : false,
          "accuracyBucket" : "precise",
          "derivedSpeedMetersPerSecond" : 0,
          "disposition" : "rejectedOutOfOrder",
          "timestamp" : 999
        },
        "distanceDelta" : 0,
        "isMoving" : false,
        "point" : null,
        "sampleInterval" : 0
      },
      "index" : 10,
      "receivedAt" : 999,
      "resetBefore" : false,
      "sample" : {
        "altitude" : 10,
        "horizontalAccuracy" : 5,
        "latitude" : 0,
        "longitude" : 0,
        "reportedSpeedMetersPerSecond" : "NaN",
        "timestamp" : 999
      }
    },
    {
      "expected" : {
        "diagnostic" : {
          "accumulatedDistance" : true,
          "accuracyBucket" : "precise",
          "derivedSpeedMetersPerSecond" : 2.2263898158654714,
          "disposition" : "accepted",
          "timestamp" : 1001
        },
        "distanceDelta" : 2.2263898158654714,
        "isMoving" : true,
        "point" : {
          "altitude" : 10,
          "latitude" : 0,
          "longitude" : 2.0000000000000002e-05,
          "speed" : 2.2263898158654714,
          "timestamp" : 1001
        },
        "sampleInterval" : 1
      },
      "index" : 11,
      "receivedAt" : 1001,
      "resetBefore" : false,
      "sample" : {
        "altitude" : 10,
        "horizontalAccuracy" : 5,
        "latitude" : 0,
        "longitude" : 2.0000000000000002e-05,
        "reportedSpeedMetersPerSecond" : "NaN",
        "timestamp" : 1001
      }
    },
    {
      "expected" : {
        "diagnostic" : {
          "accumulatedDistance" : true,
          "accuracyBucket" : "precise",
          "derivedSpeedMetersPerSecond" : 2.2263898158654714,
          "disposition" : "accepted",
          "timestamp" : 1002
        },
        "distanceDelta" : 2.2263898158654714,
        "isMoving" : true,
        "point" : {
          "altitude" : 10,
          "latitude" : 0,
          "longitude" : 4.0000000000000003e-05,
          "speed" : 2.2263898158654714,
          "timestamp" : 1002
        },
        "sampleInterval" : 1
      },
      "index" : 12,
      "receivedAt" : 1002,
      "resetBefore" : false,
      "sample" : {
        "altitude" : 10,
        "horizontalAccuracy" : 5,
        "latitude" : 0,
        "longitude" : 4.0000000000000003e-05,
        "reportedSpeedMetersPerSecond" : "NaN",
        "timestamp" : 1002
      }
    },
    {
      "expected" : {
        "diagnostic" : {
          "accumulatedDistance" : true,
          "accuracyBucket" : "precise",
          "derivedSpeedMetersPerSecond" : 2.2263898158654714,
          "disposition" : "accepted",
          "timestamp" : 1003
        },
        "distanceDelta" : 2.2263898158654714,
        "isMoving" : true,
        "point" : {